{
  "protocol": "MPAC",
  "version": "0.1.4",
  "message_type": "HELLO",
  "message_id": "97804319-45cf-468d-8567-d5cf687b2750",
  "session_id": "interop-test-session-001",
  "sender": {
    "principal_id": "agent:alice",
    "principal_type": "agent"
  },
  "ts": "2026-04-03T23:17:20.851426Z",
  "payload": {
    "display_name": "Alice Coder",
    "roles": [
      "contributor"
    ],
    "capabilities": [
      "intent.broadcast",
      "op.commit"
    ]
  },
  "watermark": {
    "kind": "lamport_clock",
    "value": 1
  }
}