{
  "protocol": "MPAC",
  "version": "0.1.4",
  "message_type": "OP_PROPOSE",
  "message_id": "492b74e0-2fa3-40bd-9d60-d73a301e9caf",
  "session_id": "interop-test-session-001",
  "sender": {
    "principal_id": "agent:alice",
    "principal_type": "agent"
  },
  "ts": "2026-04-03T23:17:20.851489Z",
  "payload": {
    "op_id": "op-alice-001",
    "intent_id": "intent-alice-001",
    "target": "src/auth.py",
    "op_kind": "replace"
  },
  "watermark": {
    "kind": "lamport_clock",
    "value": 3
  }
}