{
  "protocol": "MPAC",
  "version": "0.1.12",
  "message_type": "INTENT_ANNOUNCE",
  "message_id": "0c4646e0-eb85-41f8-a971-9908c78517e1",
  "session_id": "interop-test-session-001",
  "sender": {
    "principal_id": "agent:bob",
    "principal_type": "agent",
    "sender_instance_id": "agent:bob:693d5912-a4c9-485b-9443-360dede85470"
  },
  "ts": "2026-04-05T23:51:58.872133Z",
  "payload": {
    "intent_id": "intent-bob-002",
    "objective": "Fix auth bug",
    "scope": {
      "kind": "file_set",
      "resources": [
        "src/auth.py",
        "src/auth_test.py"
      ]
    }
  },
  "watermark": {
    "kind": "lamport_clock",
    "value": 3
  }
}