{
  "protocol": "MPAC",
  "version": "0.1.4",
  "message_type": "INTENT_ANNOUNCE",
  "message_id": "19613eb2-fcc4-4334-a0e8-26efc3bf1fa0",
  "session_id": "interop-test-session-001",
  "sender": {
    "principal_id": "agent:alice-ts",
    "principal_type": "agent"
  },
  "ts": "2026-04-03T23:17:20.895Z",
  "payload": {
    "intent_id": "intent-alice-ts-001",
    "objective": "Refactor auth module",
    "scope": {
      "kind": "file_set",
      "resources": [
        "src/auth.py",
        "src/auth_utils.py"
      ]
    }
  },
  "watermark": {
    "kind": "lamport_clock",
    "value": 2
  }
}