{
  "protocol": "MPAC",
  "version": "0.1.12",
  "message_type": "INTENT_ANNOUNCE",
  "message_id": "01b7d2c0-8877-493a-a3ce-df1459a5da36",
  "session_id": "interop-test-session-001",
  "sender": {
    "principal_id": "agent:bob-ts",
    "principal_type": "agent",
    "sender_instance_id": "agent:bob-ts:9374cab1-72f3-4679-b71b-c9fb57001931"
  },
  "ts": "2026-04-05T23:51:58.913Z",
  "payload": {
    "intent_id": "intent-bob-ts-001",
    "objective": "Update database schema",
    "scope": {
      "kind": "file_set",
      "resources": [
        "src/db.py",
        "src/migrations.py"
      ]
    }
  },
  "watermark": {
    "kind": "lamport_clock",
    "value": 2
  }
}