{
  "protocol": "MPAC",
  "version": "0.1.4",
  "message_type": "HELLO",
  "message_id": "a01930b2-2811-42ce-944c-49c271a3f3bc",
  "session_id": "interop-test-session-001",
  "sender": {
    "principal_id": "agent:alice-ts",
    "principal_type": "agent"
  },
  "ts": "2026-04-03T20:57:32.492Z",
  "payload": {
    "display_name": "Alice TS",
    "roles": [
      "contributor"
    ],
    "capabilities": [
      "intent.broadcast",
      "op.commit"
    ]
  },
  "watermark": {
    "kind": "lamport_clock",
    "value": 1
  }
}